"Isak From","Herr talman! Den borgerliga regeringens stora landsbygdsreform, var det Matlandet? Matlandet innebar att priset på mjölken sjönk. Det produceras nästan lika mycket mjölk i dag som för tio år sedan, men priserna har gått ned, för efterfrågan på lokalt producerad svensk mjölk har sjunkit. Matlandetstrategin mäktade inte med att vända den utvecklingen. Man mäktade inte med att ta fram nya produkter. Jag är från norra Västerbotten, som väl får sägas vara en del av landsbygden. Jag tycker att det känns bra att man nu har lyft in landsbygdsfrågorna i ett större perspektiv, där vi kan få en helhet. För att få utveckling i hela landet måste vi se till att tågen går. Infrastrukturfrågorna ligger nu på Näringsdepartementet. Vi måste se till att vi har en efterfrågan på våra jordbruks- och skogsprodukter, och det ligger på Näringsdepartementet. Vi måste se till att it-frågorna löses, att telefonin fungerar och att det börjar byggas bostäder i hela landet. De frågorna ligger också på Näringsdepartementet. Den socialdemokratiskt ledda regeringen har gjort bedömningen att vi måste kraftsamla för att göra det bästa möjliga av den situation som har efterlämnats av den tidigare borgerliga regeringen. Interpellanten tog också upp en annan fråga som inte varit uppe särskilt mycket än, och det är vad bankerna har med detta att göra. Jag träffade i valrörelsen en småföretagare i Gargnäs, som har hur mycket jobb som helst. Men han får inte låna något, för hans verksamhet ligger i Gargnäs. Detta kommer inte de privata bankerna att lösa, utan här krävs det en strategi för det statliga riskkapitalet. Detta är dock något som jag misstänker att vår regering kommer att återkomma till vid ett senare tillfälle. ","S"
"Kristina Yngwe","Herr talman! Jag betvivlar inte landsbygdsministerns goda intentioner när det gäller landsbygd och glesbygd. Däremot blir jag lite oroad när jag ser vilka vänner du har omkring dig. Därför blir jag också orolig när det inte längre finns något samlande departement för de här frågorna. Vi hörde tidigare kommentaren att staden nu äntligen har fått en minister. Som jag ser det har stadsperspektivet funnits genomgående i alla ministerposter, inte minst i den här regeringen. Just därför är det så viktigt att vi har ett departement som verkligen tar det samlade ansvaret för landsbygdens utveckling. Det är jag rädd för att vi kommer att tappa nu. Vi hörde en kommentar om att Centern inte har gjort några satsningar. Det vill jag bemöta: Det är inte riktigt sant. Vi har ju fått större satsningar på landsbygdsprogrammet, och satsningen på Matlandet har faktiskt lett till att intresset för närodlat och närodlad mat i det offentliga har vuxit explosionsartat.   STYLEREF Kantrubrik \\* MERGEFORMAT Svar på interpellationer Men låt mig återgå till detta med ansvar och organisation. Med de vänner du har med dig i departementet finns det många frågor kopplade till organisationen. Hur ska SLU hanteras? Hur blir det med jaktfrågor och växtskyddsfrågor? Det finns många frågor som berör de gröna näringarna som jag är lite orolig för hur de kommer att hanteras framöver. ","C"
"Börje Vestlund","Herr talman! Detta med Landsbygdsdepartementet är en tudelad fråga. Mycket av det som Kristina Yngwe tog upp handlar egentligen om sådant som också låg på Miljödepartementet. Det var inte bara it-ministern och infrastrukturministern som hade ett stort ansvar, utan det var även miljöministern. Det är precis som alla andra frågor: Landsbygden är inte annorlunda än något annat. Det krävs en lång rad insatser från många håll i vårt samhälle.  I interpellationen tog man upp de stora frågorna, det vill säga hur man ska få service på landsbygden. Där behöver vi sätta in statliga extrapengar för att det ska leva.  Jag blir alltid förvånad över den här typen av debatter. I det här fallet tog man upp skatten på handelsgödsel. Herregud, är det bara bönder som bor på landsbygden? Så har jag inte uppfattat det. Det bor en hel rad olika människor på landsbygden som inte är bönder. Det handlar alltså om lite mer än bara jordbrukspolitik. Problemet är att man har halkat totalt snett i den här debatten. Man blandar ihop jordbrukspolitik och regionalpolitik. Det är beklagligt. ","S"
"Birger Lahti","Herr talman! Jag får också gratulera landsbygdsministern till den nya arbetsplatsen. Han kommer säkert att göra sitt yttersta. Precis som Börje var inne på innefattar landsbygden mycket mer än bara jordbruk. Där finns arbetsplatser och industrier, och någon gång hamnar de i kläm. Jag ska inte lägga någon värdering i om man ska tala om Näringsdepartementet eller om det som ska läggas ned, alltså Landsbygdsdepartementet, och hur det kommer att funka, men jag hoppas att den nye landsbygdsministern försöker se till helhetsperspektivet för landsbygden och glesbygden. Jag är så pass gammal att jag har varit med om både socialdemokratiska och borgerliga regeringar. Utvecklingen har sett precis likadan ut under hela tiden. Urbaniseringen och centraliseringen har gjort att vi har utarmat landsbygden och glesbygden. Det är ingen skillnad om man ser 30 år tillbaka i tiden eller på de senaste åtta åren. Det finns säkert förklaringar till det. När det händer något i storstadsregionen, med storindustri eller något som börjar krackelera, börjar man ganska fort göra något, men när det blir problem för industrier eller större arbetsplatser på landsbygden eller i glesbygden väntar man sig faktiskt att marknaden ska sköta det. Det kommer nu att sköta sig.  STYLEREF Kantrubrik \\* MERGEFORMAT Svar på interpellationer Den nye ministern ska verkligen se till att jobba för de här frågorna, så att vi får ett helhetsperspektiv. De här arbetsplatserna och utkomsten från arbete är väldigt viktiga för glesbygden. Sedan håller jag med om det som Isak From var inne på när det gäller andra bitar också. Det handlar inte bara om företagare som behöver bankens tjänster. Att bygga en villa i landsbygden är inte samma sak som att bygga där man har ett marknadsvärde att låna till. Alla dessa problem är så stora att man behöver en motor som driver. Att skapa förutsättningar för att ens bygga ett hus är betydligt svårare i landsbygd och glesbygd, där marknaden inte sköter sig som i en storstad. Sven-Erik Bucht kan de här bitarna, och jag hoppas att han också kommer att jobba för detta. ","V"
"Landsbygdsminister Sven-Erik Bucht","Herr talman! Regeringens mål är att bidra till goda förutsättningar för arbete och välfärd i hela landet. Här är de gröna näringarna oerhört viktiga när vi talar om landsbygden. Det handlar om jordbruket, skogsbruket, fisket och också om turismen. Samtidigt måste vi få en utveckling som är miljömässigt hållbar, kombinerat med ekonomisk tillväxt - en grön tillväxt. Detta är viktigt att beakta när man jobbar med de här frågorna. Ett helhetsperspektiv är nödvändigt för att nå framgång. Håkan Svenneling frågade hur man samverkar på departementet. Om jag sitter bredvid Mehmet Kaplan, som har hand om bredbandsfrågor och mobiltelefoni, blir dessa frågor ett naturligt samtalsämne. När man gör den här omorganisationen handlar det om att föra samman frågorna och kraftsamla för svensk landsbygd, ingenting annat. En utvärdering måste givetvis göras, men inte efter två och en halv vecka. Jag förstår att en del ledamöter vill göra det fort. Okej, jag är beredd att ta det. Det kommer att hända mycket. Vi kommer att få se det tydligt när regeringen lägger fram budgetpropositionen, som regeringen har arbetat fram tillsammans med Vänsterpartiet. Där kommer en hel del exempel på när det offentliga måste gå in, som järnvägsunderhållet där staten tar över. Det är bra för landsbygden, och det är också bra för staden. Staden och landsbygden hör ihop. Mehmet Kaplan har hand om stadsutveckling. Ja, Fredrik Malm, man kan säkert säga att så här har det här departementet varit i hundra år. Men på hundra år har det hänt mycket. Under de senaste fem sex åren har det försvunnit 15 000 jobb inom jordbrukssektorn. På de senaste tio åren har antalet landsbygdsbutiker mer än halverats.  Det är i dag svårt att få koppling till dator ute på landsbygden eller att ringa. Det är ett par exempel. Det är klart att det har hänt mycket, och då måste man kraftsamla för att det ska hända saker.  Vägslitageavgift berördes här. Det tittar vi på. Den kommer att utformas utifrån att det ska bli en miljömässigt vettig vägslitageavgift. Vi har inte detaljerna på plats, men den införs inte 2015. Samma sak är det med handelsgödselskatten - den införs inte 2015. Vi säger att vi ska titta på det och överväger att införa den 2016. Men den måste också bli klimatsmart. När man senast hade den under en socialdemokratisk regering återfördes alla de medel som kom in till lantbruket, till jordbruket.   STYLEREF Kantrubrik \\* MERGEFORMAT Svar på interpellationer Kristina Yngwe var orolig för vilka vänner jag har omkring mig. Jag önskar att Kristina Yngwe kunde bli vän med mig. Jag inviterar henne och Centerpartiet. Vi kanske kunde göra någonting tillsammans för att utveckla landsbygden. Välkommen att bli vän! Jag tackar Birger Lahti för gratulationerna, vilket även gäller Isak From. Det är helhetsperspektivet som gäller. Man måste se hela landet. Tio jobb i Birger Lahtis hemkommun Pajala motsvarar 2 000 jobb i den här staden. Det är klart att vi måste se de här dimensionerna när vi pratar om hur vi ska stimulera landsbygdsutveckling och vilka insatser vi ska göra. ","S"
"Håkan Svenneling","Fru talman! Jag vill börja med att säga att jag är väldigt nöjd med den här interpellationsdebatten. Jag tycker att det har varit en bra och givande debatt om landsbygden, som ju är väldigt viktig för väldigt många människor i Sverige. Det bor faktiskt tre miljoner människor på den svenska landsbygden, och vi här i Sveriges riksdag har ett ansvar att hela tiden lyfta landsbygdens perspektiv och frågor och sätta dem på agendan. Sven-Erik Bucht får komma hit ofta och diskutera vad han ska göra för att Sveriges landsbygd ska leva och frodas.  Jag måste säga att jag ändå är positiv och nöjd med de svar jag får i dag från Sven-Erik när han säger att staten behöver ta ett ökat ansvar. Vi ser att vi kan lösa de problem på ett bra sätt där marknaden misslyckats. Det är jag mycket glad för. Man ska komma ihåg att landsbygdsutvecklingen inte blev bättre när Eskil Erlandsson bytte namn från jordbruksminister till landsbygdsminister. När man byter namn på departement, slår ihop eller reorganiserar sig är det inte då de avgörande striderna sker, utan det är när man väljer vilket innehåll politiken ska få.  Jag är fortfarande orolig för den förändring som har skett när Landsbygdsdepartementet har försvunnit; något annat kan jag inte säga. Men det är ändå politikens innehåll som avgör om vi kommer att vara nöjda med Sven-Erik Bucht som landsbygdsminister om fyra år eller inte. Det är kanske när vi går och röstar om fyra år som vi gör en utvärdering.  Det är ändå positivt med det ministern säger om samverkan. Han till och med bjuder in C. Jag skulle vilja säga att jag inte tycker att det är Centerpartiet med dess marknadslösningar som du ska bjuda in till samtal, Sven-Erik, utan du ska välja Vänsterpartiet, som är vänsteralternativet i svensk politik. Det är vi som står upp för landsbygden och för att hela Sverige ska leva. Vill regeringen göra det kan den söka vårt stöd i denna kammare för en gemensam landsbygdspolitik. Jag sträcker ut handen till dig, Sven-Erik, och är beredd att diskutera vad som behöver göras för Sveriges landsbygd. ","V"
"Landsbygdsminister Sven-Erik Bucht","Fru talman! Jag tar den utsträckta handen från Vänstern. Vi är en samarbetsregering; vi vill samverka. Men jag kan se att det finns potential för samverkan också med Centerpartiet. Nu ser jag att Kristina Yngwe tyvärr har lämnat kammaren. Regeringen har väldigt höga ambitioner, och det behövs en betydligt aktivare landsbygdspolitik. Att vi för samman Landsbygdsdepartementets frågor med Näringsdepartementets är en viktig del i våra ambitioner. Genom den förändringen får de här frågorna den kraft som de förtjänar, belyses på ett bra sätt och knyts närmare de övriga näringarna.  STYLEREF Kantrubrik \\* MERGEFORMAT Svar på interpellationer Jag tror att det här ett viktigt och avgörande steg för att få en utveckling på svensk landsbygd. Det handlar bland annat om grundläggande service, tillgång till bredband och mobilnät samt goda förutsättningar för konkurrenskraftiga företag som i förlängningen skapar jobb.  Den landsbygdspolitik som har förts fram till i dag har varit väldigt splittrad. Man har kanske inte riktigt sett potentialen i landsbygden och de gröna näringarna. Det är därför vi behöver någonting nytt. Det är min fasta övertygelse att den här ambitionen och det helhetsgrepp som vi nu tar om de här frågorna kommer att ge resultat genom att vi för en aktiv landsbygdspolitik utifrån ett helhetsperspektiv och de utmaningar som Sverige och svensk landsbygd står inför.  Tack för en mycket fin debatt! ","S"
